<?xml version="1.0" standalone "no"?>
	<!DOCTYPE Transportmittel SYSTEM "Transportmittel.dtd">
	<Transportmittel>
		<Land>
			<Strasse> LKW </Strasse>
			<Feld> Traktor</Feld>
		</Land>
		<Wasser> 
			<Meer> Hochseeschiff </Meer>
			<Fluss> Schlepper </Fluss>
		</Wasser>
		<Luft>
			<Kontinental> Propellerflugzeug </Kontinental>
			<internkontinental>Airbus</interkontinental>
		</Luft>
	</Transportmittel>
	